<?xml version="1.0" encoding="iso-8859-1"?>
<xs:schema targetNamespace="abb.pcm.objectTypes" xmlns:xsi="http://www.w3.org/2001/XMLSchema-instance" xmlns:pcm="abb.pcm.objectTypes" attributeFormDefault="unqualified" elementFormDefault="qualified" xmlns:xs="http://www.w3.org/2001/XMLSchema">
  <xs:element name="InCompatibleConnPacks">
    <xs:complexType>
      <xs:sequence>
        <xs:element maxOccurs="unbounded" name="InCompatibleConnPack">
          <xs:complexType>
            <xs:attribute name="name" type="xs:string" use="required" />
            <xs:attribute name="version" type="xs:decimal" use="required" />
          </xs:complexType>
        </xs:element>
      </xs:sequence>
      <xs:attribute name="version" type="xs:decimal" use="required" />
    </xs:complexType>
  </xs:element>
</xs:schema>